{
  "boundary": "controlled_fixture_not_production_sigstore_not_confirmatory",
  "checks": {
    "algorithm_policy": "PASS",
    "attestation_structure": "PASS",
    "bounded_input": "PASS",
    "certificate_time": "PASS",
    "closed_world_inventory": "NOT_REQUIRED",
    "manifest_canonicality": "NOT_REQUIRED",
    "manifest_json_syntax": "NOT_REQUIRED",
    "manifest_schema": "NOT_REQUIRED",
    "path_safety": "NOT_REQUIRED",
    "payload_digests": "NOT_REQUIRED",
    "provenance_policy": "NOT_REQUIRED",
    "signature_crypto": "PASS",
    "signer_policy": "PASS",
    "subject_binding": "PASS",
    "transparency": "PASS"
  },
  "decision": "ACCEPT",
  "details": {},
  "input": {
    "attestation_sha256": "655302a6f83018a35a8537db3417a3a0876160a454578a6006f8b710a5d92a54",
    "manifest_sha256": "d3586053ae2e94474df5e73be45b72f98d31e67a88d6f2fee4c982806475084f"
  },
  "primary_reason": "OK",
  "profile_id": "P2",
  "schema_version": "amy.selected-profile-fixture-result.v1-draft"
}
